{
    "runId": "shadow-types-react-mnemonic",
    "label": "react-mnemonic with handwritten local typings",
    "runType": "validation",
    "library": "react-mnemonic",
    "contextProfile": "post-issues-29-and-30-but-shadowed-types",
    "humanReviewPath": "benchmarks/ai-friendliness/validation-fixtures/shadow-types/human-review.json",
    "model": {
        "provider": "internal",
        "modelId": "manual-shadow-types",
        "runDate": "2026-03-08",
        "promptPackVersion": "v1"
    },
    "scenarios": [
        {
            "scenarioId": "theme-preference",
            "transcriptPath": "benchmarks/ai-friendliness/validation-fixtures/shadow-types/transcripts/theme-preference.md",
            "submissionDir": "benchmarks/ai-friendliness/validation-fixtures/shadow-types/submissions/theme-preference",
            "followUpPrompts": 1,
            "firstAttempt": { "compiled": true, "tested": true }
        }
    ]
}
