{
    "runId": "reference-react-mnemonic",
    "label": "Reference react-mnemonic patterns",
    "runType": "validation",
    "library": "react-mnemonic",
    "contextProfile": "post-issues-29-and-30",
    "humanReviewPath": "benchmarks/ai-friendliness/validation-fixtures/reference/human-review.json",
    "model": {
        "provider": "internal",
        "modelId": "manual-reference",
        "runDate": "2026-03-08",
        "promptPackVersion": "v1"
    },
    "scenarios": [
        {
            "scenarioId": "theme-preference",
            "transcriptPath": "benchmarks/ai-friendliness/validation-fixtures/reference/transcripts/theme-preference.md",
            "submissionDir": "benchmarks/ai-friendliness/validation-fixtures/reference/submissions/theme-preference",
            "followUpPrompts": 0,
            "firstAttempt": { "compiled": true, "tested": true }
        },
        {
            "scenarioId": "saved-filters-ephemeral-search",
            "transcriptPath": "benchmarks/ai-friendliness/validation-fixtures/reference/transcripts/saved-filters-ephemeral-search.md",
            "submissionDir": "benchmarks/ai-friendliness/validation-fixtures/reference/submissions/saved-filters-ephemeral-search",
            "followUpPrompts": 0,
            "firstAttempt": { "compiled": true, "tested": true }
        },
        {
            "scenarioId": "nullable-nickname",
            "transcriptPath": "benchmarks/ai-friendliness/validation-fixtures/reference/transcripts/nullable-nickname.md",
            "submissionDir": "benchmarks/ai-friendliness/validation-fixtures/reference/submissions/nullable-nickname",
            "followUpPrompts": 0,
            "firstAttempt": { "compiled": true, "tested": true }
        },
        {
            "scenarioId": "wizard-draft-migration",
            "transcriptPath": "benchmarks/ai-friendliness/validation-fixtures/reference/transcripts/wizard-draft-migration.md",
            "submissionDir": "benchmarks/ai-friendliness/validation-fixtures/reference/submissions/wizard-draft-migration",
            "followUpPrompts": 0,
            "firstAttempt": { "compiled": true, "tested": true }
        },
        {
            "scenarioId": "ssr-theme-badge",
            "transcriptPath": "benchmarks/ai-friendliness/validation-fixtures/reference/transcripts/ssr-theme-badge.md",
            "submissionDir": "benchmarks/ai-friendliness/validation-fixtures/reference/submissions/ssr-theme-badge",
            "followUpPrompts": 0,
            "firstAttempt": { "compiled": true, "tested": true }
        },
        {
            "scenarioId": "dismissed-banner",
            "transcriptPath": "benchmarks/ai-friendliness/validation-fixtures/reference/transcripts/dismissed-banner.md",
            "submissionDir": "benchmarks/ai-friendliness/validation-fixtures/reference/submissions/dismissed-banner",
            "followUpPrompts": 0,
            "firstAttempt": { "compiled": true, "tested": true }
        },
        {
            "scenarioId": "reset-vs-remove",
            "transcriptPath": "benchmarks/ai-friendliness/validation-fixtures/reference/transcripts/reset-vs-remove.md",
            "submissionDir": "benchmarks/ai-friendliness/validation-fixtures/reference/submissions/reset-vs-remove",
            "followUpPrompts": 0,
            "firstAttempt": { "compiled": true, "tested": true }
        }
    ]
}
