{
    "runId": "codex-gpt5-react-mnemonic-pilot",
    "label": "Pilot run for react-mnemonic under one fixed model",
    "runType": "evaluation",
    "library": "react-mnemonic",
    "contextProfile": "post-issues-29-and-30",
    "humanReviewPath": "benchmarks/ai-friendliness/runs/pilot-review.template.json",
    "model": {
        "provider": "openai",
        "modelId": "gpt-5-codex",
        "runDate": "2026-03-08",
        "promptPackVersion": "v1"
    },
    "scenarios": [
        {
            "scenarioId": "theme-preference",
            "transcriptPath": "benchmarks/ai-friendliness/runs/pilot-transcript.md",
            "submissionDir": "benchmarks/ai-friendliness/runs/pilot-submission/theme-preference",
            "followUpPrompts": 0,
            "firstAttempt": {
                "compiled": true,
                "tested": true
            }
        }
    ]
}
